{
  "$schema": "../schemas/tokens.schema.json",
  "name": "Sonic Mainnet Default Token List",
  "logoURI": "https://res.cloudinary.com/duv0g402y/image/upload/v1739450224/foundation/oe6damqveywiebwxeelf.png",
  "tags": {
    "stablecoin": {
      "name": "Stablecoin",
      "description": "Tokens that are fixed to an external asset, e.g. the US dollar"
    },
    "featured": {
      "name": "Featured",
      "description": "Tokens that are featured"
    }
  },
  "tokens": [
    {
      "chainId": 146,
      "address": "0x0000000000000000000000000000000000000000",
      "name": "Sonic Token",
      "symbol": "S",
      "decimals": 18,
      "logoURI": "https://raw.githubusercontent.com/tierra-project/token-list/main/logos/146/SONIC.png",
      "tags": [],
      "extensions": {
        "coingeckoId": "sonic-3"
      }
    },
    {
      "chainId": 146,
      "address": "0x039e2fB66102314Ce7b64Ce5Ce3E5183bc94aD38",
      "name": "Wrapped Sonic",
      "symbol": "wS",
      "decimals": 18,
      "logoURI": "https://raw.githubusercontent.com/tierra-project/token-list/main/logos/146/wS.png",
      "tags": [
        "featured"
      ],
      "extensions": {
        "coingeckoId": "wrapped-sonic"
      }
    },
    {
      "chainId": 146,
      "address": "0x29219dd400f2Bf60E5a23d13Be72B486D4038894",
      "name": "Bridged USDC",
      "symbol": "USDC.e",
      "decimals": 6,
      "logoURI": "https://raw.githubusercontent.com/tierra-project/token-list/main/logos/146/USDC.e.png",
      "tags": [
        "stablecoin",
        "featured"
      ],
      "extensions": {
        "coingeckoId": "sonic-bridged-usdc-e-sonic",
        "pythPriceId": "eaa020c61cc479712813461ce153894a96a6c00b21ed0cfc2798d1f9a9e9c94a"
      }
    },
    {
      "chainId": 146,
      "address": "0xe715cbA7B5cCb33790ceBFF1436809d36cb17E57",
      "name": "Bridged EURC",
      "symbol": "EURC.e",
      "decimals": 6,
      "logoURI": "https://raw.githubusercontent.com/tierra-project/token-list/main/logos/146/EURC.e.png",
      "tags": [
        "stablecoin"
      ],
      "extensions": {
        "coingeckoId": "euro-coin",
        "pythPriceId": "76fa85158bf14ede77087fe3ae472f66213f6ea2f5b411cb2de472794990fa5c"
      }
    },
    {
      "chainId": 146,
      "address": "0x50c42dEAcD8Fc9773493ED674b675bE577f2634b",
      "name": "Wrapped Ether on Sonic",
      "symbol": "WETH",
      "decimals": 18,
      "logoURI": "https://raw.githubusercontent.com/tierra-project/token-list/main/logos/146/WETH.png",
      "tags": [
        "featured"
      ],
      "extensions": {
        "coingeckoId": "weth",
        "pythPriceId": "9d4294bbcd1174d6f2003ec365831e64cc31d9f6f15a2b85399db8d5000960f6"
      }
    },
    {
      "chainId": 146,
      "address": "0xd3DCe716f3eF535C5Ff8d041c1A41C3bd89b97aE",
      "name": "Sonic USD",
      "symbol": "scUSD",
      "decimals": 6,
      "logoURI": "https://raw.githubusercontent.com/tierra-project/token-list/main/logos/146/scUSD.png",
      "tags": [
        "stablecoin"
      ],
      "extensions": {
        "coingeckoId": "rings-scusd",
        "pythPriceId": "316b1536978bee10c47b3c74c0b3995aabae973a3351621680a2aa383aca77b8"
      }
    },
    {
      "chainId": 146,
      "address": "0x0e0Ce4D450c705F8a0B6Dd9d5123e3df2787D16B",
      "name": "Wagmi",
      "symbol": "WAGMI",
      "decimals": 18,
      "logoURI": "https://raw.githubusercontent.com/tierra-project/token-list/main/logos/146/WAGMI.png",
      "tags": [],
      "extensions": {
        "coingeckoId": "wagmi-2",
        "pythPriceId": "7cce6e66952b0cf3d6f35d3a59e6decbe53850e67c880eee9ae876543eb5d6bd"
      }
    },
    {
      "chainId": 146,
      "address": "0xe920d1DA9A4D59126dC35996Ea242d60EFca1304",
      "name": "Derp Token",
      "symbol": "DERP",
      "decimals": 18,
      "logoURI": "https://raw.githubusercontent.com/tierra-project/token-list/main/logos/146/DERP.png",
      "tags": [],
      "extensions": {
        "coingeckoId": "derp-2"
      }
    },
    {
      "chainId": 146,
      "address": "0x3bcE5CB273F0F148010BbEa2470e7b5df84C7812",
      "name": "Sonic ETH",
      "symbol": "scETH",
      "decimals": 18,
      "logoURI": "https://raw.githubusercontent.com/tierra-project/token-list/main/logos/146/scETH.png",
      "tags": [],
      "extensions": {
        "coingeckoId": "rings-sc-eth",
        "pythPriceId": "8bb5e69ed1ab19642a0e7e851b1ed7b3579d0548bc8ddd1077b0d9476bb1dabc"
      }
    },
    {
      "chainId": 146,
      "address": "0xE51EE9868C1f0d6cd968A8B8C8376Dc2991BFE44",
      "name": "PaintSwap",
      "symbol": "BRUSH",
      "decimals": 18,
      "logoURI": "https://raw.githubusercontent.com/tierra-project/token-list/main/logos/146/BRUSH.png",
      "tags": [],
      "extensions": {
        "coingeckoId": "paint-swap"
      }
    },
    {
      "chainId": 146,
      "address": "0x486B6Fa0419b33a0c7A6e4698c231D7E2f2D5299",
      "name": "Moon Bay",
      "symbol": "MOON",
      "decimals": 18,
      "logoURI": "https://raw.githubusercontent.com/tierra-project/token-list/main/logos/146/MOON.png",
      "tags": [],
      "extensions": {
        "coingeckoId": "moon-bay-2"
      }
    },
    {
      "chainId": 146,
      "address": "0x50Bc6e1DfF8039A4b967c1BF507ba5eA13fa18B6",
      "name": "sDOG",
      "symbol": "sDOG",
      "decimals": 18,
      "logoURI": "https://raw.githubusercontent.com/tierra-project/token-list/main/logos/146/sDOG.png",
      "tags": [],
      "extensions": {}
    },
    {
      "chainId": 146,
      "address": "0x2fb960611bdC322A9a4A994252658Cae9fe2eeA1",
      "name": "Uniswap",
      "symbol": "UNI",
      "decimals": 18,
      "logoURI": "https://raw.githubusercontent.com/tierra-project/token-list/main/logos/146/UNI.png",
      "tags": [],
      "extensions": {
        "coingeckoId": "uniswap",
        "pythPriceId": "78d185a741d07edb3412b09008b7c5cfb9bbbd7d568bf00ba737b456ba171501"
      }
    },
    {
      "chainId": 146,
      "address": "0x3333111A391cC08fa51353E9195526A70b333333",
      "name": "Shadow Liquid Staking Token",
      "symbol": "x33",
      "decimals": 18,
      "logoURI": "https://raw.githubusercontent.com/tierra-project/token-list/main/logos/146/x33.png",
      "tags": [],
      "extensions": {
        "coingeckoId": "shadow-liquid-staking-token"
      }
    },
    {
      "chainId": 146,
      "address": "0x43eDD7f3831b08FE70B7555ddD373C8bF65a9050",
      "name": "Frax Ether",
      "symbol": "frxETH",
      "decimals": 18,
      "logoURI": "https://raw.githubusercontent.com/tierra-project/token-list/main/logos/146/frxETH.png",
      "tags": [],
      "extensions": {
        "coingeckoId": "frax-ether",
        "pythPriceId": "29240ee3a9024d107888eb1d4c527216f06bd64cee030c6b5575b1a8d77cb659"
      }
    },
    {
      "chainId": 146,
      "address": "0x44E23B1F3f4511b3a7e81077Fd9F2858dF1B7579",
      "name": "Millennium Club",
      "symbol": "MCLB",
      "decimals": 18,
      "logoURI": "https://raw.githubusercontent.com/tierra-project/token-list/main/logos/146/MCLB.png",
      "tags": [],
      "extensions": {
        "coingeckoId": "millennium-club"
      }
    },
    {
      "chainId": 146,
      "address": "0x455d5f11Fea33A8fa9D3e285930b478B6bF85265",
      "name": "Staked Sonic ETH",
      "symbol": "stkscETH",
      "decimals": 18,
      "logoURI": "https://raw.githubusercontent.com/tierra-project/token-list/main/logos/146/stkscETH.png",
      "tags": [],
      "extensions": {}
    },
    {
      "chainId": 146,
      "address": "0x4D85bA8c3918359c78Ed09581E5bc7578ba932ba",
      "name": "Staked Sonic USD",
      "symbol": "stkscUSD",
      "decimals": 6,
      "logoURI": "https://raw.githubusercontent.com/tierra-project/token-list/main/logos/146/stkscUSD.png",
      "tags": [],
      "extensions": {
        "pythPriceId": "b680422b70915df562e4802bd8679112ff0f6b0a29ec2c3762ae2720eda01e58"
      }
    },
    {
      "chainId": 146,
      "address": "0x5050bc082FF4A74Fb6B0B04385dEfdDB114b2424",
      "name": "xShadow",
      "symbol": "xSHADOW",
      "decimals": 18,
      "logoURI": "https://raw.githubusercontent.com/tierra-project/token-list/main/logos/146/xSHADOW.png",
      "tags": [],
      "extensions": {}
    },
    {
      "chainId": 146,
      "address": "0x5555b2733602DEd58D47b8D3D989E631CBee5555",
      "name": "Shadow Wrapped Gems",
      "symbol": "GEMS",
      "decimals": 18,
      "logoURI": "https://raw.githubusercontent.com/tierra-project/token-list/main/logos/146/GEMS.png",
      "tags": [],
      "extensions": {}
    },
    {
      "chainId": 146,
      "address": "0x578Ee1ca3a8E1b54554Da1Bf7C583506C4CD11c6",
      "name": "Aave Sonic USDC",
      "symbol": "aSonUSDC",
      "decimals": 6,
      "logoURI": "https://raw.githubusercontent.com/tierra-project/token-list/main/logos/146/aSonUSDC.png",
      "tags": [],
      "extensions": {
        "coingeckoId": "aave-usdc-sonic"
      }
    },
    {
      "chainId": 146,
      "address": "0x602BaeaB9B0DE4a99C457cf1249088932AA04FaC",
      "name": "Brunch USD",
      "symbol": "bUSD",
      "decimals": 18,
      "logoURI": "https://raw.githubusercontent.com/tierra-project/token-list/main/logos/146/bUSD.png",
      "tags": [],
      "extensions": {}
    },
    {
      "chainId": 146,
      "address": "0x6047828dc181963ba44974801FF68e538dA5eaF9",
      "name": "Tether USD",
      "symbol": "USDT",
      "decimals": 6,
      "logoURI": "https://raw.githubusercontent.com/tierra-project/token-list/main/logos/146/USDT.png",
      "tags": [],
      "extensions": {
        "pythPriceId": "2b89b9dc8fdf9f34709a5b106b472f0f39bb6ca9ce04b0fd7f2e971688e2e53b",
        "coingeckoId": "tether"
      }
    },
    {
      "chainId": 146,
      "address": "0x6202B9f02E30E5e1c62Cc01E4305450E5d83b926",
      "name": "Staked Stream USD",
      "symbol": "xUSD",
      "decimals": 6,
      "logoURI": "https://raw.githubusercontent.com/tierra-project/token-list/main/logos/146/xUSD.png",
      "tags": [],
      "extensions": {